{
  "identity": "provider-neutral-youtube-oauth-verify-20261012-r2",
  "state": "CONSUMED_BEFORE_REMOTE",
  "prepared_commit_sha": "9be6ed066413dcc03056e8b0ef79c2eb2b1affb9",
  "secret_reference": "PLM_YOUTUBE_GAME_001",
  "oauth_execution_approved": true,
  "workflow_sha256": "897c23ad3665c7575a456329429ad303608ad41e9e4ac1a5c422c8829b7cea7a",
  "executor_sha256": "0957b5de10a6ccccc10ae1afa4f25400b4c115068aebed8fc70eb9165045c1cb",
  "plan_sha256": "c2a9331b79e36f11567d6520f41a6a75298243a5f6e118d117aedfca253f220b",
  "schema_sha256": "c31c60f65f9692adf0e3643d2f5e16a69142d5b214807a5debb2f1f9e02964f7",
  "wrapper_sha256": "9531fa5871700ef90f89bdbc190981a95963cfe36e6d0c28b08b20d9cac6ea7e",
  "provider_sha256": "9fbce205a267ee3a880eb3d34b6e02d410e9aa249d78b16a686a0f559639a8e9",
  "r1_consumed_marker_sha256": "db6f46d821d9fc8f1bfd601f08deeaafa6ab7152e8e2c550ce9d3ee0219092ba",
  "r1_workflow_sha256": "2a5f8cf3ca68b9aa32767bb1be00fe29673e99547430379b1fba0b256ba62719",
  "r1_executor_sha256": "ac4cf6b1ce2fdaeaffa015831c841df753d530ac6c938573dc3af8ff70720bb2",
  "r1_plan_sha256": "84cb075f8643f608a9264806c45e57b765a10442d28aa38db9bd3b060e257f51",
  "r1_schema_sha256": "1986c96aebc1d2ba87e92a78606191095c8460c37bff8f5a1486c11ead1f6a34"
}
